{
  "$schema": "https://json-schema.org/draft/2020-12/schema",
  "$id": "https://github.com/bryanthaboi/gen1recomp-mod-index/schema/cart.schema.json",
  "title": "gen1recomp cart index entry",
  "description": "One carts/<Author>@<id>/meta.json entry. A custom cart is a version-pinned mod setup that plays as its own game: an identity, a base game, a list of mods pinned to exact builds with their options frozen, a load order, and a seal. A cart ships no code, so every mod it names is published separately and must be resolvable from a public source.",
  "type": "object",
  "additionalProperties": false,
  "required": [
    "id",
    "title",
    "author",
    "version",
    "base",
    "seal",
    "repo",
    "mods"
  ],
  "properties": {
    "id": {
      "type": "string",
      "pattern": "^[A-Za-z0-9_-]+$",
      "maxLength": 64,
      "description": "Must equal the cart bundle's id."
    },
    "title": {
      "type": "string",
      "minLength": 1,
      "maxLength": 80
    },
    "author": {
      "type": "string",
      "minLength": 1,
      "maxLength": 64
    },
    "summary": {
      "type": "string",
      "maxLength": 200,
      "description": "One-line blurb for the card. Long form goes in description.md."
    },
    "version": {
      "type": "string",
      "pattern": "^\\d+\\.\\d+\\.\\d+(?:[-+].*)?$",
      "description": "Semver of the cart bundle this entry describes."
    },
    "base": {
      "enum": [
        "red",
        "blue",
        "yellow",
        "gold",
        "silver"
      ],
      "description": "The game the cart plays as. Same name and vocabulary as the bundle's cart.json."
    },
    "seal": {
      "enum": [
        "sealed",
        "sealed+",
        "open"
      ],
      "description": "sealed: the engine loads this list and nothing else, exactly as pinned. sealed+: the list is fixed, but the player may switch a pinned mod on or off. open: the player may add more."
    },
    "speeds": {
      "type": "array",
      "minItems": 1,
      "uniqueItems": true,
      "items": {
        "type": "integer",
        "enum": [
          1,
          2,
          3,
          4,
          10,
          20,
          30,
          50,
          75,
          100,
          200
        ]
      },
      "description": "Optional. The only game-speed multipliers this cart permits. One entry pins the speed outright."
    },
    "shell": {
      "type": "string",
      "pattern": "^#[0-9A-Fa-f]{6}$",
      "description": "Cart shell colour, #RRGGBB. The entry's thumbnail doubles as the label art preview."
    },
    "finish": {
      "enum": [
        "sparkle",
        "holo",
        "sparkle+holo"
      ],
      "description": "Optional cartridge finish: sparkle flecks the shell, holo gives the label a holographic sheen."
    },
    "tags": {
      "type": "array",
      "maxItems": 8,
      "items": {
        "type": "string",
        "pattern": "^[a-z0-9][a-z0-9 -]{0,23}$"
      }
    },
    "repo": {
      "type": "string",
      "format": "uri",
      "pattern": "^https://",
      "description": "Where the cart bundle lives. Any host; GitHub unlocks version tracking."
    },
    "github": {
      "type": "string",
      "pattern": "^[A-Za-z0-9._-]+/[A-Za-z0-9._-]+$",
      "description": "owner/repo. The index refresh job reads this repo's Releases the same way it does for a mod."
    },
    "downloadURL": {
      "type": "string",
      "format": "uri",
      "pattern": "^https://",
      "description": "Direct link to an installable cart .zip (manifest and label art at the archive root). Required when github is absent."
    },
    "automatic_version_check": {
      "type": "boolean",
      "default": true,
      "description": "When true and github is set, the index refresh job re-reads Releases nightly and records the newest version."
    },
    "fixed_release_tag": {
      "type": "string",
      "description": "Pin the index to one release tag instead of tracking the newest."
    },
    "game_version": {
      "type": "string",
      "maxLength": 64,
      "description": "Engine semver range the cart needs, same grammar as the manifest."
    },
    "mods": {
      "type": "array",
      "minItems": 1,
      "maxItems": 64,
      "description": "Every mod the cart loads, each pinned to one exact build, in the bundle's own cart.json shape. The order here is the load order unless load_order overrides it.",
      "items": {
        "type": "object",
        "additionalProperties": false,
        "required": [
          "id",
          "source"
        ],
        "properties": {
          "id": {
            "type": "string",
            "pattern": "^[A-Za-z0-9_-]+$",
            "maxLength": 64,
            "description": "The pinned mod's manifest.json id."
          },
          "source": {
            "enum": [
              "github",
              "gamebanana"
            ],
            "description": "Where this exact build is published. github needs repo, version and sha256; gamebanana needs mod, file and md5."
          },
          "repo": {
            "type": "string",
            "pattern": "^[A-Za-z0-9._-]+/[A-Za-z0-9._-]+$",
            "description": "github: owner/repo the release zip comes from."
          },
          "version": {
            "type": "string",
            "pattern": "^\\d+\\.\\d+\\.\\d+(?:[-+].*)?$",
            "description": "github: semver of the pinned release."
          },
          "sha256": {
            "type": "string",
            "pattern": "^[0-9a-f]{64}$",
            "description": "github: digest of the pinned zip."
          },
          "mod": {
            "type": "integer",
            "minimum": 1,
            "description": "gamebanana: mod page id."
          },
          "file": {
            "type": "integer",
            "minimum": 1,
            "description": "gamebanana: file id of the pinned upload."
          },
          "md5": {
            "type": "string",
            "pattern": "^[0-9a-f]{32}$",
            "description": "gamebanana: digest GameBanana reports for that file."
          },
          "enabled": {
            "type": "boolean",
            "description": "Ship this mod pinned but switched off. Absent means on. Pair it with the sealed+ seal so the player can switch it on and get your settings."
          },
          "options": {
            "type": "object",
            "description": "The mod's option values, frozen as the cart author set them."
          }
        }
      }
    },
    "load_order": {
      "type": "array",
      "uniqueItems": true,
      "items": {
        "type": "string",
        "pattern": "^[A-Za-z0-9_-]+$"
      },
      "description": "Pinned mod ids, first loaded first. Must name exactly the ids in mods. Omit to load in the order mods lists them."
    },
    "license": {
      "type": "string",
      "maxLength": 64
    }
  }
}
