{
  "id": "wild_green",
  "title": "Wild Green",
  "author": "Wild",
  "version": "1.0.0",
  "summary": "The definitive way to play Red: every quality-of-life and visual upgrade in the Gen1Wild suite that still feels like Red, and all 151 catchable in one save, on one version, without trading.",
  "base": "red",
  "seal": "sealed+",
  "shell": "#14571f",
  "tags": [
    "cart",
    "bundle",
    "collection",
    "green",
    "player",
    "sprites",
    "ui",
    "quality of life"
  ],
  "repo": "https://github.com/wild1walker/Gen1WildGreen",
  "github": "wild1walker/Gen1WildGreen",
  "automatic_version_check": true,
  "game_version": ">=0.1.37 <2.0.0",
  "license": "MIT",
  "mods": [
    {
      "id": "gen1_wild_qol",
      "source": "github",
      "repo": "wild1walker/Gen1WildQOL",
      "version": "1.11.1",
      "sha256": "18959ac0f2a6769d1dec7246471b2b9eae9517edd512a7a425bd9bd3615f9027"
    },
    {
      "id": "crystal_animated_sprites_with_shiny_visuals",
      "source": "github",
      "repo": "distilledorion-sketch/crystal_animated_sprites_with_shiny_visuals",
      "version": "2.0.2",
      "sha256": "59b6204e66dc14c32b3035fea115236080dfc33ec86f928f04ac6974a1aca86c"
    },
    {
      "id": "gen1_wild_ui",
      "source": "github",
      "repo": "wild1walker/Gen1WildUI",
      "version": "1.12.0",
      "sha256": "c4015d0b7d9492aefe5830c75cfb85ed00b1525cbad0907462abefaaa2a4a536"
    },
    {
      "id": "wild_green",
      "source": "github",
      "repo": "wild1walker/Gen1MakeItGreen",
      "version": "1.23.0",
      "sha256": "3eadecd1216b45c279805376d938ba3152d4d1c38d829cf80e4c3358abb8c55a",
      "options": {
        "ribbon": true
      }
    }
  ],
  "load_order": [
    "gen1_wild_qol",
    "crystal_animated_sprites_with_shiny_visuals",
    "gen1_wild_ui",
    "wild_green"
  ]
}
