{
  "id": "omega_random_competition",
  "title": "OMEGA RANDOM COMPETITION",
  "author": "bryanthaboi",
  "summary": "Bois Club Randomizer as its own cartridge. One seed from your name and the clock, paired warps, and a speed ladder pinned to 1x or 2x.",
  "version": "1.0.0",
  "base": "red",
  "seal": "sealed",
  "shell": "#7B1B22",
  "finish": "holo",
  "speeds": [
    1,
    2
  ],
  "tags": [
    "randomizer",
    "competition",
    "seeded"
  ],
  "repo": "https://github.com/bryanthaboi/omega-random-competition",
  "github": "bryanthaboi/omega-random-competition",
  "automatic_version_check": true,
  "mods": [
    {
      "id": "bcr",
      "source": "github",
      "repo": "bryanthaboi/bcr",
      "version": "1.0.0",
      "sha256": "83a111b49c4e8c4fd4d6886d60a673372cb9e9d334e091360048587da23938f0"
    }
  ],
  "load_order": [
    "bcr"
  ],
  "license": "MIT"
}
